1443817535.972240 IP 127.0.0.1.53678 > 255.255.255.255.80: Flags [S], seq 4173560241, win 14600, options [mss 1460,sackOK,TS val 2472289776 ecr 0,nop,wscale 7], length 0
1443817535.981865 IP 255.255.255.255.80 > 127.0.0.1.53678: Flags [S.], seq 2963972603, ack 4173560242, win 4380, options [mss 1460,sackOK,TS val 2770592028 ecr 2472289776,wscale 4,eol], length 0
1443817535.981882 IP 127.0.0.1.53678 > 255.255.255.255.80: Flags [.], ack 2963972604, win 115, options [nop,nop,TS val 2472289786 ecr 2770592028], length 0
1443817535.982069 IP 127.0.0.1.53678 > 255.255.255.255.80: Flags [P.], seq 4173560242:4173561044, ack 2963972604, win 115, options [nop,nop,TS val 2472289786 ecr 2770592028], length 802
1443817535.991823 IP 255.255.255.255.80 > 127.0.0.1.53678: Flags [.], ack 4173561044, win 323, length 0
1443817535.993749 IP 255.255.255.255.80 > 127.0.0.1.53678: Flags [P.], seq 2963972604:2963972695, ack 4173561044, win 323, length 91
1443817535.993766 IP 127.0.0.1.53678 > 255.255.255.255.80: Flags [.], ack 2963972695, win 115, options [nop,nop,TS val 2472289798 ecr 2770592028], length 0
1443817535.994948 IP 127.0.0.1.53678 > 255.255.255.255.80: Flags [P.], seq 4173561044:4173562014, ack 2963972695, win 115, options [nop,nop,TS val 2472289799 ecr 2770592028], length 970
1443817536.004825 IP 255.255.255.255.80 > 127.0.0.1.53678: Flags [.], ack 4173562014, win 384, length 0
1443817536.009310 IP 255.255.255.255.80 > 127.0.0.1.53678: Flags [P.], seq 2963972695:2963972786, ack 4173562014, win 384, length 91
1443817536.048410 IP 127.0.0.1.53678 > 255.255.255.255.80: Flags [.], ack 2963972786, win 115, options [nop,nop,TS val 2472289853 ecr 2770592028], length 0
1443817536.109694 IP 255.255.255.255.80 > 127.0.0.1.53678: Flags [F.], seq 2963972786, ack 4173562014, win 384, length 0
1443817536.109863 IP 127.0.0.1.53678 > 255.255.255.255.80: Flags [F.], seq 4173562014, ack 2963972787, win 115, options [nop,nop,TS val 2472289914 ecr 2770592028], length 0
1443817536.119788 IP 255.255.255.255.80 > 127.0.0.1.53678: Flags [.], ack 4173562015, win 384, length 0