1444821267.066446 IP 127.0.0.1.51468 > 127.0.0.1.11311: Flags [P.], seq 1322930592:1322930650, ack 690185937, win 1024, options [nop,nop,TS val 3476020871 ecr 3476019619], length 58
1444821267.066963 IP 127.0.0.1.11311 > 127.0.0.1.51468: Flags [P.], seq 690185937:690187337, ack 1322930650, win 342, options [nop,nop,TS val 3476020871 ecr 3476020871], length 1400
1444821267.066981 IP 127.0.0.1.51468 > 127.0.0.1.11311: Flags [.], ack 690187337, win 1015, options [nop,nop,TS val 3476020871 ecr 3476020871], length 0
1444821267.066997 IP 127.0.0.1.11311 > 127.0.0.1.51468: Flags [P.], seq 690187337:690187708, ack 1322930650, win 342, options [nop,nop,TS val 3476020871 ecr 3476020871], length 371
1444821267.067006 IP 127.0.0.1.51468 > 127.0.0.1.11311: Flags [.], ack 690187708, win 1013, options [nop,nop,TS val 3476020871 ecr 3476020871], length 0
1444821267.085517 IP 127.0.0.1.51574 > 127.0.0.1.11311: Flags [P.], seq 1008512345:1008512403, ack 4210698335, win 1024, options [nop,nop,TS val 3476020890 ecr 3476019630], length 58
1444821267.086031 IP 127.0.0.1.11311 > 127.0.0.1.51574: Flags [P.], seq 4210698335:4210699735, ack 1008512403, win 342, options [nop,nop,TS val 3476020890 ecr 3476020890], length 1400
1444821267.086063 IP 127.0.0.1.51574 > 127.0.0.1.11311: Flags [.], ack 4210699735, win 1015, options [nop,nop,TS val 3476020890 ecr 3476020890], length 0
1444821267.086082 IP 127.0.0.1.11311 > 127.0.0.1.51574: Flags [P.], seq 4210699735:4210700436, ack 1008512403, win 342, options [nop,nop,TS val 3476020890 ecr 3476020890], length 701
1444821267.086092 IP 127.0.0.1.51574 > 127.0.0.1.11311: Flags [.], ack 4210700436, win 1010, options [nop,nop,TS val 3476020890 ecr 3476020890], length 0
1444821267.092608 IP 127.0.0.1.58883 > 127.0.0.1.11311: Flags [P.], seq 2211204227:2211204285, ack 3066441127, win 1024, options [nop,nop,TS val 3476020897 ecr 3476019639], length 58
1444821267.093042 IP 127.0.0.1.11311 > 127.0.0.1.58883: Flags [P.], seq 3066441127:3066442527, ack 2211204285, win 342, options [nop,nop,TS val 3476020897 ecr 3476020897], length 1400
1444821267.093059 IP 127.0.0.1.58883 > 127.0.0.1.11311: Flags [.], ack 3066442527, win 1015, options [nop,nop,TS val 3476020897 ecr 3476020897], length 0
1444821267.093075 IP 127.0.0.1.11311 > 127.0.0.1.58883: Flags [P.], seq 3066442527:3066442822, ack 2211204285, win 342, options [nop,nop,TS val 3476020897 ecr 3476020897], length 295
1444821267.093087 IP 127.0.0.1.58883 > 127.0.0.1.11311: Flags [.], ack 3066442822, win 1013, options [nop,nop,TS val 3476020897 ecr 3476020897], length 0
1444821267.100639 IP 127.0.0.1.46893 > 127.0.0.1.11311: Flags [P.], seq 2094371749:2094371807, ack 956517339, win 1024, options [nop,nop,TS val 3476020905 ecr 3476019645], length 58
1444821267.100993 IP 127.0.0.1.11311 > 127.0.0.1.46893: Flags [P.], seq 956517339:956517397, ack 2094371807, win 342, options [nop,nop,TS val 3476020905 ecr 3476020905], length 58
1444821267.101013 IP 127.0.0.1.46893 > 127.0.0.1.11311: Flags [.], ack 956517397, win 1024, options [nop,nop,TS val 3476020905 ecr 3476020905], length 0
1444821267.110078 IP 127.0.0.1.34756 > 127.0.0.1.11311: Flags [P.], seq 3324914225:3324914283, ack 820414305, win 1024, options [nop,nop,TS val 3476020914 ecr 3476019664], length 58
1444821267.110453 IP 127.0.0.1.11311 > 127.0.0.1.34756: Flags [P.], seq 820414305:820414363, ack 3324914283, win 342, options [nop,nop,TS val 3476020915 ecr 3476020914], length 58
1444821267.110473 IP 127.0.0.1.34756 > 127.0.0.1.11311: Flags [.], ack 820414363, win 1024, options [nop,nop,TS val 3476020915 ecr 3476020915], length 0
1444821267.114714 IP 127.0.0.1.43443 > 127.0.0.1.11311: Flags [P.], seq 1546337017:1546337075, ack 714262322, win 1024, options [nop,nop,TS val 3476020919 ecr 3476019670], length 58
1444821267.115158 IP 127.0.0.1.11311 > 127.0.0.1.43443: Flags [P.], seq 714262322:714263722, ack 1546337075, win 342, options [nop,nop,TS val 3476020919 ecr 3476020919], length 1400
1444821267.115177 IP 127.0.0.1.43443 > 127.0.0.1.11311: Flags [.], ack 714263722, win 1015, options [nop,nop,TS val 3476020919 ecr 3476020919], length 0
1444821267.115192 IP 127.0.0.1.11311 > 127.0.0.1.43443: Flags [P.], seq 714263722:714264691, ack 1546337075, win 342, options [nop,nop,TS val 3476020919 ecr 3476020919], length 969
1444821267.115201 IP 127.0.0.1.43443 > 127.0.0.1.11311: Flags [.], ack 714264691, win 1008, options [nop,nop,TS val 3476020919 ecr 3476020919], length 0
1444821267.116286 IP 127.0.0.1.53362 > 127.0.0.1.11311: Flags [P.], seq 2087858268:2087858326, ack 2451773028, win 1024, options [nop,nop,TS val 3476020920 ecr 3476019682], length 58
1444821267.116689 IP 127.0.0.1.11311 > 127.0.0.1.53362: Flags [P.], seq 2451773028:2451774428, ack 2087858326, win 342, options [nop,nop,TS val 3476020921 ecr 3476020920], length 1400
1444821267.116715 IP 127.0.0.1.53362 > 127.0.0.1.11311: Flags [.], ack 2451774428, win 1015, options [nop,nop,TS val 3476020921 ecr 3476020921], length 0
1444821267.116736 IP 127.0.0.1.11311 > 127.0.0.1.53362: Flags [P.], seq 2451774428:2451774783, ack 2087858326, win 342, options [nop,nop,TS val 3476020921 ecr 3476020921], length 355
1444821267.116748 IP 127.0.0.1.53362 > 127.0.0.1.11311: Flags [.], ack 2451774783, win 1015, options [nop,nop,TS val 3476020921 ecr 3476020921], length 0
1444821267.119250 IP 127.0.0.1.53737 > 127.0.0.1.11311: Flags [P.], seq 1507865649:1507865707, ack 3123638240, win 1024, options [nop,nop,TS val 3476020923 ecr 3476019685], length 58
1444821267.119693 IP 127.0.0.1.11311 > 127.0.0.1.53737: Flags [P.], seq 3123638240:3123639640, ack 1507865707, win 342, options [nop,nop,TS val 3476020924 ecr 3476020923], length 1400
1444821267.119732 IP 127.0.0.1.53737 > 127.0.0.1.11311: Flags [.], ack 3123639640, win 1015, options [nop,nop,TS val 3476020924 ecr 3476020924], length 0
1444821267.119747 IP 127.0.0.1.11311 > 127.0.0.1.53737: Flags [P.], seq 3123639640:3123640534, ack 1507865707, win 342, options [nop,nop,TS val 3476020924 ecr 3476020924], length 894
1444821267.119757 IP 127.0.0.1.53737 > 127.0.0.1.11311: Flags [.], ack 3123640534, win 1009, options [nop,nop,TS val 3476020924 ecr 3476020924], length 0
1444821267.121027 IP 127.0.0.1.53305 > 127.0.0.1.11311: Flags [P.], seq 2287929661:2287929719, ack 1790555335, win 1024, options [nop,nop,TS val 3476020925 ecr 3476019687], length 58
1444821267.121454 IP 127.0.0.1.11311 > 127.0.0.1.53305: Flags [P.], seq 1790555335:1790556735, ack 2287929719, win 342, options [nop,nop,TS val 3476020926 ecr 3476020925], length 1400
1444821267.121470 IP 127.0.0.1.53305 > 127.0.0.1.11311: Flags [.], ack 1790556735, win 1015, options [nop,nop,TS val 3476020926 ecr 3476020926], length 0
1444821267.121485 IP 127.0.0.1.11311 > 127.0.0.1.53305: Flags [P.], seq 1790556735:1790558235, ack 2287929719, win 342, options [nop,nop,TS val 3476020926 ecr 3476020926], length 1500
1444821267.121497 IP 127.0.0.1.53305 > 127.0.0.1.11311: Flags [.], ack 1790558235, win 1006, options [nop,nop,TS val 3476020926 ecr 3476020926], length 0
1444821267.132621 IP 127.0.0.1.45685 > 127.0.0.1.11311: Flags [P.], seq 3618867477:3618867535, ack 3118327749, win 1024, options [nop,nop,TS val 3476020937 ecr 3476019693], length 58
1444821267.133082 IP 127.0.0.1.11311 > 127.0.0.1.45685: Flags [P.], seq 3118327749:3118327807, ack 3618867535, win 342, options [nop,nop,TS val 3476020937 ecr 3476020937], length 58
1444821267.133108 IP 127.0.0.1.45685 > 127.0.0.1.11311: Flags [.], ack 3118327807, win 1024, options [nop,nop,TS val 3476020937 ecr 3476020937], length 0
1444821267.142982 IP 127.0.0.1.36498 > 127.0.0.1.11311: Flags [P.], seq 1104878493:1104878551, ack 3748855684, win 1024, options [nop,nop,TS val 3476020947 ecr 3476019693], length 58
1444821267.143363 IP 127.0.0.1.11311 > 127.0.0.1.36498: Flags [P.], seq 3748855684:3748855742, ack 1104878551, win 342, options [nop,nop,TS val 3476020947 ecr 3476020947], length 58
1444821267.143382 IP 127.0.0.1.36498 > 127.0.0.1.11311: Flags [.], ack 3748855742, win 1024, options [nop,nop,TS val 3476020947 ecr 3476020947], length 0
1444821267.144403 IP 127.0.0.1.50667 > 127.0.0.1.11311: Flags [P.], seq 507070900:507070958, ack 2088715485, win 1024, options [nop,nop,TS val 3476020948 ecr 3476019693], length 58
1444821267.144822 IP 127.0.0.1.11311 > 127.0.0.1.50667: Flags [P.], seq 2088715485:2088716885, ack 507070958, win 342, options [nop,nop,TS val 3476020949 ecr 3476020948], length 1400
1444821267.144838 IP 127.0.0.1.50667 > 127.0.0.1.11311: Flags [.], ack 2088716885, win 1015, options [nop,nop,TS val 3476020949 ecr 3476020949], length 0
1444821267.144851 IP 127.0.0.1.11311 > 127.0.0.1.50667: Flags [P.], seq 2088716885:2088718360, ack 507070958, win 342, options [nop,nop,TS val 3476020949 ecr 3476020949], length 1475
1444821267.144861 IP 127.0.0.1.50667 > 127.0.0.1.11311: Flags [.], ack 2088718360, win 1006, options [nop,nop,TS val 3476020949 ecr 3476020949], length 0
1444821267.152323 IP 127.0.0.1.48578 > 127.0.0.1.11311: Flags [P.], seq 823491004:823491062, ack 1431618821, win 1024, options [nop,nop,TS val 3476020956 ecr 3476019703], length 58
1444821267.152744 IP 127.0.0.1.11311 > 127.0.0.1.48578: Flags [P.], seq 1431618821:1431618879, ack 823491062, win 342, options [nop,nop,TS val 3476020957 ecr 3476020956], length 58
1444821267.152764 IP 127.0.0.1.48578 > 127.0.0.1.11311: Flags [.], ack 1431618879, win 1024, options [nop,nop,TS val 3476020957 ecr 3476020957], length 0
1444821267.164737 IP 127.0.0.1.56245 > 127.0.0.1.11311: Flags [P.], seq 1004353138:1004353196, ack 185012592, win 1024, options [nop,nop,TS val 3476020969 ecr 3476019703], length 58
1444821267.165249 IP 127.0.0.1.11311 > 127.0.0.1.56245: Flags [P.], seq 185012592:185013992, ack 1004353196, win 342, options [nop,nop,TS val 3476020969 ecr 3476020969], length 1400
1444821267.165263 IP 127.0.0.1.56245 > 127.0.0.1.11311: Flags [.], ack 185013992, win 1015, options [nop,nop,TS val 3476020969 ecr 3476020969], length 0
1444821267.165274 IP 127.0.0.1.11311 > 127.0.0.1.56245: Flags [P.], seq 185013992:185015190, ack 1004353196, win 342, options [nop,nop,TS val 3476020969 ecr 3476020969], length 1198
1444821267.165284 IP 127.0.0.1.56245 > 127.0.0.1.11311: Flags [.], ack 185015190, win 1006, options [nop,nop,TS val 3476020969 ecr 3476020969], length 0
1444821267.173730 IP 127.0.0.1.63716 > 127.0.0.1.11311: Flags [P.], seq 2641883427:2641883485, ack 4215118237, win 1024, options [nop,nop,TS val 3476020978 ecr 3476019705], length 58
1444821267.174172 IP 127.0.0.1.11311 > 127.0.0.1.63716: Flags [P.], seq 4215118237:4215119637, ack 2641883485, win 342, options [nop,nop,TS val 3476020978 ecr 3476020978], length 1400
1444821267.174196 IP 127.0.0.1.63716 > 127.0.0.1.11311: Flags [.], ack 4215119637, win 1015, options [nop,nop,TS val 3476020978 ecr 3476020978], length 0
1444821267.174219 IP 127.0.0.1.11311 > 127.0.0.1.63716: Flags [P.], seq 4215119637:4215120591, ack 2641883485, win 342, options [nop,nop,TS val 3476020978 ecr 3476020978], length 954
1444821267.174233 IP 127.0.0.1.63716 > 127.0.0.1.11311: Flags [.], ack 4215120591, win 1008, options [nop,nop,TS val 3476020978 ecr 3476020978], length 0
1444821267.177590 IP 127.0.0.1.60031 > 127.0.0.1.11311: Flags [P.], seq 3677600597:3677600655, ack 1083855793, win 1024, options [nop,nop,TS val 3476020982 ecr 3476019746], length 58
1444821267.177863 IP 127.0.0.1.48730 > 127.0.0.1.11311: Flags [P.], seq 2511682446:2511682504, ack 474592461, win 1024, options [nop,nop,TS val 3476020982 ecr 3476019750], length 58
1444821267.178013 IP 127.0.0.1.11311 > 127.0.0.1.60031: Flags [P.], seq 1083855793:1083857193, ack 3677600655, win 342, options [nop,nop,TS val 3476020982 ecr 3476020982], length 1400
1444821267.178032 IP 127.0.0.1.60031 > 127.0.0.1.11311: Flags [.], ack 1083857193, win 1015, options [nop,nop,TS val 3476020982 ecr 3476020982], length 0
1444821267.178049 IP 127.0.0.1.11311 > 127.0.0.1.60031: Flags [P.], seq 1083857193:1083858254, ack 3677600655, win 342, options [nop,nop,TS val 3476020982 ecr 3476020982], length 1061
1444821267.178065 IP 127.0.0.1.60031 > 127.0.0.1.11311: Flags [.], ack 1083858254, win 1007, options [nop,nop,TS val 3476020982 ecr 3476020982], length 0
1444821267.178323 IP 127.0.0.1.11311 > 127.0.0.1.48730: Flags [P.], seq 474592461:474593861, ack 2511682504, win 342, options [nop,nop,TS val 3476020982 ecr 3476020982], length 1400
1444821267.178335 IP 127.0.0.1.48730 > 127.0.0.1.11311: Flags [.], ack 474593861, win 1015, options [nop,nop,TS val 3476020982 ecr 3476020982], length 0
1444821267.178347 IP 127.0.0.1.11311 > 127.0.0.1.48730: Flags [P.], seq 474593861:474594388, ack 2511682504, win 342, options [nop,nop,TS val 3476020982 ecr 3476020982], length 527
1444821267.178355 IP 127.0.0.1.48730 > 127.0.0.1.11311: Flags [.], ack 474594388, win 1011, options [nop,nop,TS val 3476020982 ecr 3476020982], length 0
1444821267.183807 IP 127.0.0.1.34812 > 127.0.0.1.11311: Flags [P.], seq 1635828116:1635828174, ack 304428328, win 1024, options [nop,nop,TS val 3476020988 ecr 3476019752], length 58
1444821267.184277 IP 127.0.0.1.11311 > 127.0.0.1.34812: Flags [P.], seq 304428328:304429331, ack 1635828174, win 342, options [nop,nop,TS val 3476020988 ecr 3476020988], length 1003
1444821267.184305 IP 127.0.0.1.34812 > 127.0.0.1.11311: Flags [.], ack 304429331, win 1017, options [nop,nop,TS val 3476020988 ecr 3476020988], length 0
1444821267.203355 IP 127.0.0.1.35680 > 127.0.0.1.11311: Flags [P.], seq 763165143:763165201, ack 3460586003, win 1024, options [nop,nop,TS val 3476021007 ecr 3476019753], length 58
1444821267.203776 IP 127.0.0.1.11311 > 127.0.0.1.35680: Flags [P.], seq 3460586003:3460586254, ack 763165201, win 342, options [nop,nop,TS val 3476021008 ecr 3476021007], length 251
1444821267.203801 IP 127.0.0.1.35680 > 127.0.0.1.11311: Flags [.], ack 3460586254, win 1023, options [nop,nop,TS val 3476021008 ecr 3476021008], length 0
1444821267.209901 IP 127.0.0.1.39402 > 127.0.0.1.11311: Flags [P.], seq 2568113514:2568113572, ack 2292519940, win 1024, options [nop,nop,TS val 3476021014 ecr 3476019758], length 58
1444821267.210374 IP 127.0.0.1.11311 > 127.0.0.1.39402: Flags [P.], seq 2292519940:2292521340, ack 2568113572, win 342, options [nop,nop,TS val 3476021014 ecr 3476021014], length 1400
1444821267.210391 IP 127.0.0.1.39402 > 127.0.0.1.11311: Flags [.], ack 2292521340, win 1015, options [nop,nop,TS val 3476021014 ecr 3476021014], length 0
1444821267.210421 IP 127.0.0.1.11311 > 127.0.0.1.39402: Flags [P.], seq 2292521340:2292522104, ack 2568113572, win 342, options [nop,nop,TS val 3476021015 ecr 3476021014], length 764
1444821267.210433 IP 127.0.0.1.39402 > 127.0.0.1.11311: Flags [.], ack 2292522104, win 1010, options [nop,nop,TS val 3476021015 ecr 3476021015], length 0
1444821267.211179 IP 127.0.0.1.39211 > 127.0.0.1.11311: Flags [P.], seq 3233896757:3233896815, ack 3164045462, win 1024, options [nop,nop,TS val 3476021015 ecr 3476019766], length 58
1444821267.211661 IP 127.0.0.1.11311 > 127.0.0.1.39211: Flags [P.], seq 3164045462:3164046862, ack 3233896815, win 342, options [nop,nop,TS val 3476021016 ecr 3476021015], length 1400
1444821267.211677 IP 127.0.0.1.39211 > 127.0.0.1.11311: Flags [.], ack 3164046862, win 1015, options [nop,nop,TS val 3476021016 ecr 3476021016], length 0
1444821267.211691 IP 127.0.0.1.11311 > 127.0.0.1.39211: Flags [P.], seq 3164046862:3164047593, ack 3233896815, win 342, options [nop,nop,TS val 3476021016 ecr 3476021016], length 731
1444821267.211704 IP 127.0.0.1.39211 > 127.0.0.1.11311: Flags [.], ack 3164047593, win 1010, options [nop,nop,TS val 3476021016 ecr 3476021016], length 0
1444821267.216788 IP 127.0.0.1.47581 > 127.0.0.1.11311: Flags [P.], seq 860662486:860662544, ack 3514524860, win 1024, options [nop,nop,TS val 3476021021 ecr 3476019768], length 58
1444821267.217274 IP 127.0.0.1.11311 > 127.0.0.1.47581: Flags [P.], seq 3514524860:3514526260, ack 860662544, win 342, options [nop,nop,TS val 3476021021 ecr 3476021021], length 1400
1444821267.217291 IP 127.0.0.1.47581 > 127.0.0.1.11311: Flags [.], ack 3514526260, win 1015, options [nop,nop,TS val 3476021021 ecr 3476021021], length 0
1444821267.217310 IP 127.0.0.1.11311 > 127.0.0.1.47581: Flags [P.], seq 3514526260:3514527760, ack 860662544, win 342, options [nop,nop,TS val 3476021021 ecr 3476021021], length 1500
1444821267.217331 IP 127.0.0.1.47581 > 127.0.0.1.11311: Flags [.], ack 3514527760, win 1006, options [nop,nop,TS val 3476021021 ecr 3476021021], length 0
1444821267.234005 IP 127.0.0.1.63267 > 127.0.0.1.11311: Flags [P.], seq 524108350:524108408, ack 820045067, win 1024, options [nop,nop,TS val 3476021038 ecr 3476019789], length 58
1444821267.234451 IP 127.0.0.1.11311 > 127.0.0.1.63267: Flags [P.], seq 820045067:820046467, ack 524108408, win 342, options [nop,nop,TS val 3476021039 ecr 3476021038], length 1400
1444821267.234467 IP 127.0.0.1.63267 > 127.0.0.1.11311: Flags [.], ack 820046467, win 1015, options [nop,nop,TS val 3476021039 ecr 3476021039], length 0
1444821267.234480 IP 127.0.0.1.11311 > 127.0.0.1.63267: Flags [P.], seq 820046467:820047221, ack 524108408, win 342, options [nop,nop,TS val 3476021039 ecr 3476021039], length 754
1444821267.234490 IP 127.0.0.1.63267 > 127.0.0.1.11311: Flags [.], ack 820047221, win 1010, options [nop,nop,TS val 3476021039 ecr 3476021039], length 0
1444821267.234985 IP 127.0.0.1.64319 > 127.0.0.1.11311: Flags [P.], seq 2170382523:2170382581, ack 1026913869, win 1024, options [nop,nop,TS val 3476021039 ecr 3476019804], length 58
1444821267.235506 IP 127.0.0.1.11311 > 127.0.0.1.64319: Flags [P.], seq 1026913869:1026913927, ack 2170382581, win 342, options [nop,nop,TS val 3476021040 ecr 3476021039], length 58
1444821267.235526 IP 127.0.0.1.64319 > 127.0.0.1.11311: Flags [.], ack 1026913927, win 1024, options [nop,nop,TS val 3476021040 ecr 3476021040], length 0
1444821267.244887 IP 127.0.0.1.48262 > 127.0.0.1.11311: Flags [P.], seq 24194869:24194927, ack 2921010031, win 1024, options [nop,nop,TS val 3476021049 ecr 3476019808], length 58
1444821267.245313 IP 127.0.0.1.11311 > 127.0.0.1.48262: Flags [P.], seq 2921010031:2921011431, ack 24194927, win 342, options [nop,nop,TS val 3476021049 ecr 3476021049], length 1400
1444821267.245328 IP 127.0.0.1.48262 > 127.0.0.1.11311: Flags [.], ack 2921011431, win 1015, options [nop,nop,TS val 3476021049 ecr 3476021049], length 0
1444821267.245343 IP 127.0.0.1.11311 > 127.0.0.1.48262: Flags [P.], seq 2921011431:2921012016, ack 24194927, win 342, options [nop,nop,TS val 3476021049 ecr 3476021049], length 585
1444821267.245351 IP 127.0.0.1.48262 > 127.0.0.1.11311: Flags [.], ack 2921012016, win 1011, options [nop,nop,TS val 3476021049 ecr 3476021049], length 0
1444821267.248363 IP 127.0.0.1.43732 > 127.0.0.1.11311: Flags [P.], seq 3946420181:3946420239, ack 2579421345, win 1024, options [nop,nop,TS val 3476021052 ecr 3476019809], length 58
1444821267.248798 IP 127.0.0.1.11311 > 127.0.0.1.43732: Flags [P.], seq 2579421345:2579421691, ack 3946420239, win 342, options [nop,nop,TS val 3476021053 ecr 3476021052], length 346
1444821267.248824 IP 127.0.0.1.43732 > 127.0.0.1.11311: Flags [.], ack 2579421691, win 1022, options [nop,nop,TS val 3476021053 ecr 3476021053], length 0
1444821267.255971 IP 127.0.0.1.35830 > 127.0.0.1.11311: Flags [P.], seq 3652753868:3652753926, ack 4222152088, win 1024, options [nop,nop,TS val 3476021060 ecr 3476019823], length 58
1444821267.256447 IP 127.0.0.1.11311 > 127.0.0.1.35830: Flags [P.], seq 4222152088:4222153488, ack 3652753926, win 342, options [nop,nop,TS val 3476021061 ecr 3476021060], length 1400
1444821267.256464 IP 127.0.0.1.35830 > 127.0.0.1.11311: Flags [.], ack 4222153488, win 1015, options [nop,nop,TS val 3476021061 ecr 3476021061], length 0
1444821267.256484 IP 127.0.0.1.11311 > 127.0.0.1.35830: Flags [P.], seq 4222153488:4222154186, ack 3652753926, win 342, options [nop,nop,TS val 3476021061 ecr 3476021061], length 698
1444821267.256499 IP 127.0.0.1.35830 > 127.0.0.1.11311: Flags [.], ack 4222154186, win 1010, options [nop,nop,TS val 3476021061 ecr 3476021061], length 0
1444821267.272193 IP 127.0.0.1.37644 > 127.0.0.1.11311: Flags [P.], seq 1299451248:1299451306, ack 1956178225, win 1024, options [nop,nop,TS val 3476021076 ecr 3476019848], length 58
1444821267.272193 IP 127.0.0.1.35609 > 127.0.0.1.11311: Flags [P.], seq 2392109494:2392109552, ack 3826476267, win 1024, options [nop,nop,TS val 3476021076 ecr 3476019833], length 58
1444821267.272677 IP 127.0.0.1.11311 > 127.0.0.1.35609: Flags [P.], seq 3826476267:3826477667, ack 2392109552, win 342, options [nop,nop,TS val 3476021077 ecr 3476021076], length 1400
1444821267.272689 IP 127.0.0.1.35609 > 127.0.0.1.11311: Flags [.], ack 3826477667, win 1015, options [nop,nop,TS val 3476021077 ecr 3476021077], length 0
1444821267.272691 IP 127.0.0.1.11311 > 127.0.0.1.37644: Flags [P.], seq 1956178225:1956179625, ack 1299451306, win 342, options [nop,nop,TS val 3476021077 ecr 3476021076], length 1400
1444821267.272703 IP 127.0.0.1.11311 > 127.0.0.1.35609: Flags [P.], seq 3826477667:3826478294, ack 2392109552, win 342, options [nop,nop,TS val 3476021077 ecr 3476021077], length 627
1444821267.272712 IP 127.0.0.1.35609 > 127.0.0.1.11311: Flags [.], ack 3826478294, win 1011, options [nop,nop,TS val 3476021077 ecr 3476021077], length 0
1444821267.272712 IP 127.0.0.1.37644 > 127.0.0.1.11311: Flags [.], ack 1956179625, win 1015, options [nop,nop,TS val 3476021077 ecr 3476021077], length 0
1444821267.272732 IP 127.0.0.1.11311 > 127.0.0.1.37644: Flags [P.], seq 1956179625:1956180252, ack 1299451306, win 342, options [nop,nop,TS val 3476021077 ecr 3476021077], length 627
1444821267.272747 IP 127.0.0.1.37644 > 127.0.0.1.11311: Flags [.], ack 1956180252, win 1011, options [nop,nop,TS val 3476021077 ecr 3476021077], length 0
1444821267.287294 IP 127.0.0.1.53307 > 127.0.0.1.11311: Flags [P.], seq 2794887844:2794887902, ack 1047680665, win 1024, options [nop,nop,TS val 3476021091 ecr 3476019849], length 58
1444821267.287827 IP 127.0.0.1.11311 > 127.0.0.1.53307: Flags [P.], seq 1047680665:1047682065, ack 2794887902, win 342, options [nop,nop,TS val 3476021092 ecr 3476021091], length 1400
1444821267.287849 IP 127.0.0.1.53307 > 127.0.0.1.11311: Flags [.], ack 1047682065, win 1015, options [nop,nop,TS val 3476021092 ecr 3476021092], length 0
1444821267.287870 IP 127.0.0.1.11311 > 127.0.0.1.53307: Flags [P.], seq 1047682065:1047682427, ack 2794887902, win 342, options [nop,nop,TS val 3476021092 ecr 3476021092], length 362
1444821267.287885 IP 127.0.0.1.53307 > 127.0.0.1.11311: Flags [.], ack 1047682427, win 1013, options [nop,nop,TS val 3476021092 ecr 3476021092], length 0
1444821267.291286 IP 127.0.0.1.63272 > 127.0.0.1.11311: Flags [P.], seq 1426484872:1426484930, ack 1822612222, win 1024, options [nop,nop,TS val 3476021095 ecr 3476019851], length 58
1444821267.291804 IP 127.0.0.1.11311 > 127.0.0.1.63272: Flags [P.], seq 1822612222:1822613622, ack 1426484930, win 342, options [nop,nop,TS val 3476021096 ecr 3476021095], length 1400
1444821267.291820 IP 127.0.0.1.63272 > 127.0.0.1.11311: Flags [.], ack 1822613622, win 1015, options [nop,nop,TS val 3476021096 ecr 3476021096], length 0
1444821267.291837 IP 127.0.0.1.11311 > 127.0.0.1.63272: Flags [P.], seq 1822613622:1822614540, ack 1426484930, win 342, options [nop,nop,TS val 3476021096 ecr 3476021096], length 918
1444821267.291849 IP 127.0.0.1.63272 > 127.0.0.1.11311: Flags [.], ack 1822614540, win 1008, options [nop,nop,TS val 3476021096 ecr 3476021096], length 0
1444821267.297342 IP 127.0.0.1.35997 > 127.0.0.1.11311: Flags [P.], seq 2515630598:2515630656, ack 2541604090, win 1024, options [nop,nop,TS val 3476021101 ecr 3476019853], length 58
1444821267.297852 IP 127.0.0.1.11311 > 127.0.0.1.35997: Flags [P.], seq 2541604090:2541605490, ack 2515630656, win 342, options [nop,nop,TS val 3476021102 ecr 3476021101], length 1400
1444821267.297867 IP 127.0.0.1.35997 > 127.0.0.1.11311: Flags [.], ack 2541605490, win 1015, options [nop,nop,TS val 3476021102 ecr 3476021102], length 0
1444821267.297880 IP 127.0.0.1.11311 > 127.0.0.1.35997: Flags [P.], seq 2541605490:2541606756, ack 2515630656, win 342, options [nop,nop,TS val 3476021102 ecr 3476021102], length 1266
1444821267.297891 IP 127.0.0.1.35997 > 127.0.0.1.11311: Flags [.], ack 2541606756, win 1006, options [nop,nop,TS val 3476021102 ecr 3476021102], length 0
1444821267.298833 IP 127.0.0.1.63036 > 127.0.0.1.11311: Flags [P.], seq 4277551540:4277551598, ack 792104382, win 1024, options [nop,nop,TS val 3476021103 ecr 3476019858], length 58
1444821267.299240 IP 127.0.0.1.11311 > 127.0.0.1.63036: Flags [P.], seq 792104382:792105782, ack 4277551598, win 342, options [nop,nop,TS val 3476021103 ecr 3476021103], length 1400
1444821267.299259 IP 127.0.0.1.63036 > 127.0.0.1.11311: Flags [.], ack 792105782, win 1015, options [nop,nop,TS val 3476021103 ecr 3476021103], length 0
1444821267.299280 IP 127.0.0.1.11311 > 127.0.0.1.63036: Flags [P.], seq 792105782:792106447, ack 4277551598, win 342, options [nop,nop,TS val 3476021103 ecr 3476021103], length 665
1444821267.299295 IP 127.0.0.1.63036 > 127.0.0.1.11311: Flags [.], ack 792106447, win 1010, options [nop,nop,TS val 3476021103 ecr 3476021103], length 0
1444821267.303965 IP 127.0.0.1.42704 > 127.0.0.1.11311: Flags [P.], seq 1620944000:1620944058, ack 1917693531, win 1024, options [nop,nop,TS val 3476021108 ecr 3476019870], length 58
1444821267.304496 IP 127.0.0.1.11311 > 127.0.0.1.42704: Flags [P.], seq 1917693531:1917694931, ack 1620944058, win 342, options [nop,nop,TS val 3476021109 ecr 3476021108], length 1400
1444821267.304529 IP 127.0.0.1.42704 > 127.0.0.1.11311: Flags [.], ack 1917694931, win 1015, options [nop,nop,TS val 3476021109 ecr 3476021109], length 0
1444821267.304546 IP 127.0.0.1.11311 > 127.0.0.1.42704: Flags [P.], seq 1917694931:1917695390, ack 1620944058, win 342, options [nop,nop,TS val 3476021109 ecr 3476021109], length 459
1444821267.304559 IP 127.0.0.1.42704 > 127.0.0.1.11311: Flags [.], ack 1917695390, win 1012, options [nop,nop,TS val 3476021109 ecr 3476021109], length 0
1444821267.305541 IP 127.0.0.1.40032 > 127.0.0.1.11311: Flags [P.], seq 2009060161:2009060219, ack 2169689511, win 1024, options [nop,nop,TS val 3476021110 ecr 3476019888], length 58
1444821267.306050 IP 127.0.0.1.11311 > 127.0.0.1.40032: Flags [P.], seq 2169689511:2169689569, ack 2009060219, win 342, options [nop,nop,TS val 3476021110 ecr 3476021110], length 58
1444821267.306071 IP 127.0.0.1.40032 > 127.0.0.1.11311: Flags [.], ack 2169689569, win 1024, options [nop,nop,TS val 3476021110 ecr 3476021110], length 0
1444821267.312738 IP 127.0.0.1.51133 > 127.0.0.1.11311: Flags [P.], seq 2773897331:2773897389, ack 4206883441, win 1024, options [nop,nop,TS val 3476021117 ecr 3476019894], length 58
1444821267.313180 IP 127.0.0.1.11311 > 127.0.0.1.51133: Flags [P.], seq 4206883441:4206883499, ack 2773897389, win 342, options [nop,nop,TS val 3476021117 ecr 3476021117], length 58
1444821267.313202 IP 127.0.0.1.51133 > 127.0.0.1.11311: Flags [.], ack 4206883499, win 1024, options [nop,nop,TS val 3476021117 ecr 3476021117], length 0
1444821267.313940 IP 127.0.0.1.41631 > 127.0.0.1.11311: Flags [P.], seq 3728757848:3728757906, ack 4249325538, win 1024, options [nop,nop,TS val 3476021118 ecr 3476019896], length 58
1444821267.314472 IP 127.0.0.1.11311 > 127.0.0.1.41631: Flags [P.], seq 4249325538:4249326938, ack 3728757906, win 342, options [nop,nop,TS val 3476021119 ecr 3476021118], length 1400
1444821267.314492 IP 127.0.0.1.41631 > 127.0.0.1.11311: Flags [.], ack 4249326938, win 1015, options [nop,nop,TS val 3476021119 ecr 3476021119], length 0
1444821267.314507 IP 127.0.0.1.11311 > 127.0.0.1.41631: Flags [P.], seq 4249326938:4249327362, ack 3728757906, win 342, options [nop,nop,TS val 3476021119 ecr 3476021119], length 424
1444821267.314515 IP 127.0.0.1.41631 > 127.0.0.1.11311: Flags [.], ack 4249327362, win 1012, options [nop,nop,TS val 3476021119 ecr 3476021119], length 0
1444821267.324751 IP 127.0.0.1.49095 > 127.0.0.1.11311: Flags [P.], seq 4254050972:4254051030, ack 720501386, win 1024, options [nop,nop,TS val 3476021129 ecr 3476019924], length 58
1444821267.325373 IP 127.0.0.1.11311 > 127.0.0.1.49095: Flags [P.], seq 720501386:720502786, ack 4254051030, win 342, options [nop,nop,TS val 3476021129 ecr 3476021129], length 1400
1444821267.325416 IP 127.0.0.1.49095 > 127.0.0.1.11311: Flags [.], ack 720502786, win 1015, options [nop,nop,TS val 3476021130 ecr 3476021129], length 0
1444821267.325443 IP 127.0.0.1.11311 > 127.0.0.1.49095: Flags [P.], seq 720502786:720503510, ack 4254051030, win 342, options [nop,nop,TS val 3476021130 ecr 3476021130], length 724
1444821267.325455 IP 127.0.0.1.49095 > 127.0.0.1.11311: Flags [.], ack 720503510, win 1010, options [nop,nop,TS val 3476021130 ecr 3476021130], length 0
1444821267.325896 IP 127.0.0.1.64444 > 127.0.0.1.11311: Flags [P.], seq 3524027785:3524027843, ack 569063835, win 1024, options [nop,nop,TS val 3476021130 ecr 3476019924], length 58
1444821267.326382 IP 127.0.0.1.11311 > 127.0.0.1.64444: Flags [P.], seq 569063835:569065235, ack 3524027843, win 342, options [nop,nop,TS val 3476021130 ecr 3476021130], length 1400
1444821267.326409 IP 127.0.0.1.64444 > 127.0.0.1.11311: Flags [.], ack 569065235, win 1015, options [nop,nop,TS val 3476021130 ecr 3476021130], length 0
1444821267.326431 IP 127.0.0.1.11311 > 127.0.0.1.64444: Flags [P.], seq 569065235:569066446, ack 3524027843, win 342, options [nop,nop,TS val 3476021131 ecr 3476021130], length 1211
1444821267.326444 IP 127.0.0.1.64444 > 127.0.0.1.11311: Flags [.], ack 569066446, win 1006, options [nop,nop,TS val 3476021131 ecr 3476021131], length 0
1444821267.337187 IP 127.0.0.1.43063 > 127.0.0.1.11311: Flags [P.], seq 1810642593:1810642651, ack 1218915921, win 1024, options [nop,nop,TS val 3476021141 ecr 3476019951], length 58
1444821267.337714 IP 127.0.0.1.11311 > 127.0.0.1.43063: Flags [P.], seq 1218915921:1218917321, ack 1810642651, win 342, options [nop,nop,TS val 3476021142 ecr 3476021141], length 1400
1444821267.337736 IP 127.0.0.1.43063 > 127.0.0.1.11311: Flags [.], ack 1218917321, win 1015, options [nop,nop,TS val 3476021142 ecr 3476021142], length 0
1444821267.337759 IP 127.0.0.1.11311 > 127.0.0.1.43063: Flags [P.], seq 1218917321:1218917823, ack 1810642651, win 342, options [nop,nop,TS val 3476021142 ecr 3476021142], length 502
1444821267.337776 IP 127.0.0.1.43063 > 127.0.0.1.11311: Flags [.], ack 1218917823, win 1012, options [nop,nop,TS val 3476021142 ecr 3476021142], length 0
1444821267.338266 IP 127.0.0.1.33556 > 127.0.0.1.11311: Flags [P.], seq 805376170:805376228, ack 2239580287, win 1024, options [nop,nop,TS val 3476021142 ecr 3476019953], length 58
1444821267.338672 IP 127.0.0.1.11311 > 127.0.0.1.33556: Flags [P.], seq 2239580287:2239580345, ack 805376228, win 342, options [nop,nop,TS val 3476021143 ecr 3476021142], length 58
1444821267.338691 IP 127.0.0.1.33556 > 127.0.0.1.11311: Flags [.], ack 2239580345, win 1024, options [nop,nop,TS val 3476021143 ecr 3476021143], length 0
1444821267.342152 IP 127.0.0.1.64766 > 127.0.0.1.11311: Flags [P.], seq 2304220872:2304220930, ack 43373327, win 1024, options [nop,nop,TS val 3476021146 ecr 3476019958], length 58
1444821267.342616 IP 127.0.0.1.11311 > 127.0.0.1.64766: Flags [P.], seq 43373327:43374727, ack 2304220930, win 342, options [nop,nop,TS val 3476021147 ecr 3476021146], length 1400
1444821267.342641 IP 127.0.0.1.64766 > 127.0.0.1.11311: Flags [.], ack 43374727, win 1015, options [nop,nop,TS val 3476021147 ecr 3476021147], length 0
1444821267.342654 IP 127.0.0.1.11311 > 127.0.0.1.64766: Flags [P.], seq 43374727:43375191, ack 2304220930, win 342, options [nop,nop,TS val 3476021147 ecr 3476021147], length 464
1444821267.342664 IP 127.0.0.1.64766 > 127.0.0.1.11311: Flags [.], ack 43375191, win 1012, options [nop,nop,TS val 3476021147 ecr 3476021147], length 0
1444821267.348666 IP 127.0.0.1.57167 > 127.0.0.1.11311: Flags [P.], seq 314853743:314853801, ack 862824760, win 1024, options [nop,nop,TS val 3476021153 ecr 3476019963], length 58
1444821267.349202 IP 127.0.0.1.11311 > 127.0.0.1.57167: Flags [P.], seq 862824760:862826160, ack 314853801, win 342, options [nop,nop,TS val 3476021153 ecr 3476021153], length 1400
1444821267.349223 IP 127.0.0.1.57167 > 127.0.0.1.11311: Flags [.], ack 862826160, win 1015, options [nop,nop,TS val 3476021153 ecr 3476021153], length 0
1444821267.349242 IP 127.0.0.1.11311 > 127.0.0.1.57167: Flags [P.], seq 862826160:862826491, ack 314853801, win 342, options [nop,nop,TS val 3476021153 ecr 3476021153], length 331
1444821267.349256 IP 127.0.0.1.57167 > 127.0.0.1.11311: Flags [.], ack 862826491, win 1013, options [nop,nop,TS val 3476021153 ecr 3476021153], length 0
1444821267.349578 IP 127.0.0.1.59349 > 127.0.0.1.11311: Flags [P.], seq 3472955882:3472955940, ack 684585531, win 1024, options [nop,nop,TS val 3476021154 ecr 3476019966], length 58
1444821267.349987 IP 127.0.0.1.11311 > 127.0.0.1.59349: Flags [P.], seq 684585531:684585589, ack 3472955940, win 342, options [nop,nop,TS val 3476021154 ecr 3476021154], length 58
1444821267.350007 IP 127.0.0.1.59349 > 127.0.0.1.11311: Flags [.], ack 684585589, win 1024, options [nop,nop,TS val 3476021154 ecr 3476021154], length 0
1444821267.353271 IP 127.0.0.1.53303 > 127.0.0.1.11311: Flags [P.], seq 3402482927:3402482985, ack 3574911782, win 1024, options [nop,nop,TS val 3476021157 ecr 3476019969], length 58
1444821267.353743 IP 127.0.0.1.11311 > 127.0.0.1.53303: Flags [P.], seq 3574911782:3574913182, ack 3402482985, win 342, options [nop,nop,TS val 3476021158 ecr 3476021157], length 1400
1444821267.353760 IP 127.0.0.1.53303 > 127.0.0.1.11311: Flags [.], ack 3574913182, win 1015, options [nop,nop,TS val 3476021158 ecr 3476021158], length 0
1444821267.353776 IP 127.0.0.1.11311 > 127.0.0.1.53303: Flags [P.], seq 3574913182:3574913391, ack 3402482985, win 342, options [nop,nop,TS val 3476021158 ecr 3476021158], length 209
1444821267.353786 IP 127.0.0.1.53303 > 127.0.0.1.11311: Flags [.], ack 3574913391, win 1015, options [nop,nop,TS val 3476021158 ecr 3476021158], length 0
1444821267.357009 IP 127.0.0.1.33497 > 127.0.0.1.11311: Flags [P.], seq 2704073124:2704073182, ack 4195567019, win 1024, options [nop,nop,TS val 3476021161 ecr 3476019973], length 58
1444821267.357445 IP 127.0.0.1.11311 > 127.0.0.1.33497: Flags [P.], seq 4195567019:4195567077, ack 2704073182, win 342, options [nop,nop,TS val 3476021162 ecr 3476021161], length 58
1444821267.357471 IP 127.0.0.1.33497 > 127.0.0.1.11311: Flags [.], ack 4195567077, win 1024, options [nop,nop,TS val 3476021162 ecr 3476021162], length 0
1444821267.360657 IP 127.0.0.1.60340 > 127.0.0.1.11311: Flags [P.], seq 2532412910:2532412968, ack 824654665, win 1024, options [nop,nop,TS val 3476021165 ecr 3476019982], length 58
1444821267.361161 IP 127.0.0.1.11311 > 127.0.0.1.60340: Flags [P.], seq 824654665:824656065, ack 2532412968, win 342, options [nop,nop,TS val 3476021165 ecr 3476021165], length 1400
1444821267.361185 IP 127.0.0.1.60340 > 127.0.0.1.11311: Flags [.], ack 824656065, win 1015, options [nop,nop,TS val 3476021165 ecr 3476021165], length 0
1444821267.361203 IP 127.0.0.1.11311 > 127.0.0.1.60340: Flags [P.], seq 824656065:824657304, ack 2532412968, win 342, options [nop,nop,TS val 3476021165 ecr 3476021165], length 1239
1444821267.361219 IP 127.0.0.1.60340 > 127.0.0.1.11311: Flags [.], ack 824657304, win 1015, options [nop,nop,TS val 3476021165 ecr 3476021165], length 0
1444821267.363477 IP 127.0.0.1.32805 > 127.0.0.1.11311: Flags [P.], seq 480484871:480484929, ack 3117235683, win 1024, options [nop,nop,TS val 3476021168 ecr 3476019995], length 58
1444821267.364041 IP 127.0.0.1.11311 > 127.0.0.1.32805: Flags [P.], seq 3117235683:3117237083, ack 480484929, win 342, options [nop,nop,TS val 3476021168 ecr 3476021168], length 1400
1444821267.364063 IP 127.0.0.1.32805 > 127.0.0.1.11311: Flags [.], ack 3117237083, win 1015, options [nop,nop,TS val 3476021168 ecr 3476021168], length 0
1444821267.364086 IP 127.0.0.1.11311 > 127.0.0.1.32805: Flags [P.], seq 3117237083:3117238381, ack 480484929, win 342, options [nop,nop,TS val 3476021168 ecr 3476021168], length 1298
1444821267.364102 IP 127.0.0.1.32805 > 127.0.0.1.11311: Flags [.], ack 3117238381, win 1006, options [nop,nop,TS val 3476021168 ecr 3476021168], length 0
1444821267.392875 IP 127.0.0.1.47207 > 127.0.0.1.11311: Flags [P.], seq 211584848:211584906, ack 3303275994, win 1024, options [nop,nop,TS val 3476021197 ecr 3476020006], length 58
1444821267.393363 IP 127.0.0.1.11311 > 127.0.0.1.47207: Flags [P.], seq 3303275994:3303277394, ack 211584906, win 342, options [nop,nop,TS val 3476021197 ecr 3476021197], length 1400
1444821267.393384 IP 127.0.0.1.47207 > 127.0.0.1.11311: Flags [.], ack 3303277394, win 1015, options [nop,nop,TS val 3476021197 ecr 3476021197], length 0
1444821267.393411 IP 127.0.0.1.11311 > 127.0.0.1.47207: Flags [P.], seq 3303277394:3303278021, ack 211584906, win 342, options [nop,nop,TS val 3476021197 ecr 3476021197], length 627
1444821267.393426 IP 127.0.0.1.47207 > 127.0.0.1.11311: Flags [.], ack 3303278021, win 1011, options [nop,nop,TS val 3476021198 ecr 3476021197], length 0
1444821267.421197 IP 127.0.0.1.58352 > 127.0.0.1.11311: Flags [P.], seq 2788518186:2788518244, ack 3247303812, win 1024, options [nop,nop,TS val 3476021225 ecr 3476020006], length 58
1444821267.421729 IP 127.0.0.1.11311 > 127.0.0.1.58352: Flags [P.], seq 3247303812:3247305212, ack 2788518244, win 342, options [nop,nop,TS val 3476021226 ecr 3476021225], length 1400
1444821267.421757 IP 127.0.0.1.58352 > 127.0.0.1.11311: Flags [.], ack 3247305212, win 1015, options [nop,nop,TS val 3476021226 ecr 3476021226], length 0
1444821267.421791 IP 127.0.0.1.11311 > 127.0.0.1.58352: Flags [P.], seq 3247305212:3247306712, ack 2788518244, win 342, options [nop,nop,TS val 3476021226 ecr 3476021226], length 1500
1444821267.421804 IP 127.0.0.1.58352 > 127.0.0.1.11311: Flags [.], ack 3247306712, win 1015, options [nop,nop,TS val 3476021226 ecr 3476021226], length 0
1444821267.433105 IP 127.0.0.1.50247 > 127.0.0.1.11311: Flags [P.], seq 1322993802:1322993860, ack 240325194, win 1024, options [nop,nop,TS val 3476021237 ecr 3476020007], length 58
1444821267.433548 IP 127.0.0.1.11311 > 127.0.0.1.50247: Flags [P.], seq 240325194:240325252, ack 1322993860, win 342, options [nop,nop,TS val 3476021238 ecr 3476021237], length 58
1444821267.433565 IP 127.0.0.1.50247 > 127.0.0.1.11311: Flags [.], ack 240325252, win 1024, options [nop,nop,TS val 3476021238 ecr 3476021238], length 0
1444821267.439955 IP 127.0.0.1.47583 > 127.0.0.1.11311: Flags [P.], seq 1297522141:1297522199, ack 2902053943, win 1024, options [nop,nop,TS val 3476021244 ecr 3476020027], length 58
1444821267.440493 IP 127.0.0.1.11311 > 127.0.0.1.47583: Flags [P.], seq 2902053943:2902055343, ack 1297522199, win 342, options [nop,nop,TS val 3476021245 ecr 3476021244], length 1400
1444821267.440521 IP 127.0.0.1.47583 > 127.0.0.1.11311: Flags [.], ack 2902055343, win 1015, options [nop,nop,TS val 3476021245 ecr 3476021245], length 0
1444821267.440552 IP 127.0.0.1.11311 > 127.0.0.1.47583: Flags [P.], seq 2902055343:2902056649, ack 1297522199, win 342, options [nop,nop,TS val 3476021245 ecr 3476021245], length 1306
1444821267.440566 IP 127.0.0.1.47583 > 127.0.0.1.11311: Flags [.], ack 2902056649, win 1006, options [nop,nop,TS val 3476021245 ecr 3476021245], length 0
1444821267.450140 IP 127.0.0.1.35515 > 127.0.0.1.11311: Flags [P.], seq 3239209337:3239209395, ack 674685634, win 1024, options [nop,nop,TS val 3476021254 ecr 3476020029], length 58
1444821267.450606 IP 127.0.0.1.11311 > 127.0.0.1.35515: Flags [P.], seq 674685634:674685692, ack 3239209395, win 342, options [nop,nop,TS val 3476021255 ecr 3476021254], length 58
1444821267.450631 IP 127.0.0.1.35515 > 127.0.0.1.11311: Flags [.], ack 674685692, win 1024, options [nop,nop,TS val 3476021255 ecr 3476021255], length 0
